{"cas_ref":"cas://sha256/d1998c26b8a57f268725accf79a33b6628fb6a888a1c015b74b2c3dd12431e93","category":"transition","derivation":{"calibration_sha256":"bde680518546eaef708f190a7087b5d7b6623a1b744826d5e9565d63d2c5d549","deidentified_derivative_sha256":null,"extraction_artifact_sha256":"a4538c3f436407ff29253a36dab8599d225b14b098fd705267f9feb31eae0d61","extraction_tool_sha256":"31bf7993fcce9b02c47a3ce14c8217f2c3cc79063a895cf155bc9718079cd4a2","extraction_tool_version":"import-frame-corpus-v1","parent_pixel_digest":null,"redaction_artifact_sha256":null,"redaction_mode":"not_applicable_hash_only","source_artifact_sha256":"e72d6e77711c8e3977d83a677eab30f859fdefa1700eb50f0efc73b8f9361075","transform_version":"capture-v1"},"expected_admission":"accepted","expected_reason_code":"accepted","expected_status":"accepted","pixel_artifact_sha256":"b4c10a28312e8dfe92e9a0c76e05f5707a1a02f5b6bdf7516537b79e0de7ca02","pixel_digest":"d1998c26b8a57f268725accf79a33b6628fb6a888a1c015b74b2c3dd12431e93","pixel_spec":{"channels":3,"dtype":"uint8","height":1080,"length":6220800,"pixel_format":"BGR8","stride":5760,"width":1920},"privacy":{"class":"restricted","license_id":"user-provided-project-evaluation","retention":"candidate"},"record_digest":"19c91b0be10dc1a60fab241e138f30880173ea292dce0930f1439858e7ebb00a","review":{"adjudication_id":null,"independent_decision":null,"independent_reviewer_id":null,"primary_decision":"confirmed","primary_reviewer_id":"reviewer-codex-primary-001"},"sample_id":"b2-frame-198","schema_version":"1.0.0","sequence":2110,"session_id":"user-training-ground-i-20260829","source_id":"user-video-training-ground-i","source_locator":{"kind":"frame_index","timing_truth":false,"value":2110},"source_provenance_id":"703e65e56f2b009aab04d52bfd7e5cab4f8abb42e28919970aeaca767c909689","truth_id":"b2-truth-198","truth_scope":"frame_ingestion_only","wrong_size_negative":false}
