{"cas_ref":"cas://sha256/96664bc0995fc146fdd8d4072b22648bbe9bb160e8b3339ccbd19b663c5379d4","category":"wrong_size","derivation":{"calibration_sha256":"bde680518546eaef708f190a7087b5d7b6623a1b744826d5e9565d63d2c5d549","deidentified_derivative_sha256":null,"extraction_artifact_sha256":"0298b5e09176e22b65fa4ce71a32d82bbd6fe535dfaffa14eae85a9e663b93d9","extraction_tool_sha256":"31bf7993fcce9b02c47a3ce14c8217f2c3cc79063a895cf155bc9718079cd4a2","extraction_tool_version":"import-frame-corpus-v1","parent_pixel_digest":null,"redaction_artifact_sha256":null,"redaction_mode":"not_applicable_hash_only","source_artifact_sha256":"663c90623903436c657b4a633e9d29e19ff529734d641886993e57d826aa1229","transform_version":"capture-v1"},"expected_admission":"fatal","expected_reason_code":"frame_size_changed","expected_status":"frame_size_changed","pixel_artifact_sha256":"f0274de52a4c6de5cfd443aa3b05d187237c1c1ac6288101bfef7e8a268e1787","pixel_digest":"96664bc0995fc146fdd8d4072b22648bbe9bb160e8b3339ccbd19b663c5379d4","pixel_spec":{"channels":3,"dtype":"uint8","height":720,"length":2764800,"pixel_format":"BGR8","stride":3840,"width":1280},"privacy":{"class":"restricted","license_id":"user-provided-project-evaluation","retention":"candidate"},"record_digest":"4396f0d42cd05ba9226d30f286b0e930b4eb2158815122a19cd9b00818bdac5b","review":{"adjudication_id":null,"independent_decision":null,"independent_reviewer_id":null,"primary_decision":"confirmed","primary_reviewer_id":"reviewer-codex-primary-001"},"sample_id":"b2-frame-242","schema_version":"1.0.0","sequence":828,"session_id":"user-wrong-size-1280x720-20260829","source_id":"user-video-wrong-size-1280x720","source_locator":{"kind":"frame_index","timing_truth":false,"value":828},"source_provenance_id":"22623667d9dc0ae4dce96286f3825d470eca8dac6d586dc49734efd732e736c2","truth_id":"b2-truth-242","truth_scope":"frame_ingestion_only","wrong_size_negative":true}
