{"cas_ref":"cas://sha256/b29689583c0250d02a523c75883508bcaad6f22c9b73863388bff115ab6c0d0c","category":"motion","derivation":{"calibration_sha256":"bde680518546eaef708f190a7087b5d7b6623a1b744826d5e9565d63d2c5d549","deidentified_derivative_sha256":null,"extraction_artifact_sha256":"254bae476b6729c578987bdb724047a3dced6877b26231d0a731c53055a47d9c","extraction_tool_sha256":"31bf7993fcce9b02c47a3ce14c8217f2c3cc79063a895cf155bc9718079cd4a2","extraction_tool_version":"import-frame-corpus-v1","parent_pixel_digest":null,"redaction_artifact_sha256":null,"redaction_mode":"not_applicable_hash_only","source_artifact_sha256":"62b3b2f362a60087dffadb1d5529c4d7a27440adf61a28d30b685c7cda3b273f","transform_version":"capture-v1"},"expected_admission":"accepted","expected_reason_code":"accepted","expected_status":"accepted","pixel_artifact_sha256":"cf855e1989738ebf869df3674bbcc2a8b324e766d169b739cbab609583b3be4f","pixel_digest":"b29689583c0250d02a523c75883508bcaad6f22c9b73863388bff115ab6c0d0c","pixel_spec":{"channels":3,"dtype":"uint8","height":1080,"length":6220800,"pixel_format":"BGR8","stride":5760,"width":1920},"privacy":{"class":"restricted","license_id":"operator-controlled-live-capture","retention":"candidate"},"record_digest":"23a33929b5cc9cbbbec1bc271229d58dffba9af601a1d1ec6729dabde9c430d8","review":{"adjudication_id":null,"independent_decision":null,"independent_reviewer_id":null,"primary_decision":"confirmed","primary_reviewer_id":"reviewer-codex-primary-001"},"sample_id":"b2-frame-042","schema_version":"1.0.0","sequence":4334,"session_id":"vc003-live-20260829T140846Z","source_id":"capture-card-primary","source_locator":{"kind":"live_sequence","timing_truth":false,"value":4334},"source_provenance_id":"94c2a899429c230ded1d56307bfb418e4049405cbd419c75bdd89353db867f91","truth_id":"b2-truth-042","truth_scope":"frame_ingestion_only","wrong_size_negative":false}
