{"cas_ref":"cas://sha256/ec0a2e9c5d83c5b6b9e7712a7396b284b2a0c2b7b0af983b8170753dcb9b0cf8","category":"motion","derivation":{"calibration_sha256":"bde680518546eaef708f190a7087b5d7b6623a1b744826d5e9565d63d2c5d549","deidentified_derivative_sha256":null,"extraction_artifact_sha256":"2fef83ed7fbbd49e6b26429f913d38ceebe81409a51e0651fade53f2b336bcea","extraction_tool_sha256":"31bf7993fcce9b02c47a3ce14c8217f2c3cc79063a895cf155bc9718079cd4a2","extraction_tool_version":"import-frame-corpus-v1","parent_pixel_digest":null,"redaction_artifact_sha256":null,"redaction_mode":"not_applicable_hash_only","source_artifact_sha256":"e72d6e77711c8e3977d83a677eab30f859fdefa1700eb50f0efc73b8f9361075","transform_version":"capture-v1"},"expected_admission":"accepted","expected_reason_code":"accepted","expected_status":"accepted","pixel_artifact_sha256":"7bbf5982906290cf9a3d747fba509e56bb3bd90625be8d125d9d301ee66e43ff","pixel_digest":"ec0a2e9c5d83c5b6b9e7712a7396b284b2a0c2b7b0af983b8170753dcb9b0cf8","pixel_spec":{"channels":3,"dtype":"uint8","height":1080,"length":6220800,"pixel_format":"BGR8","stride":5760,"width":1920},"privacy":{"class":"restricted","license_id":"user-provided-project-evaluation","retention":"candidate"},"record_digest":"efd15b52b3206b169217d059c11b992d5266d9eb5c749272d6e96ece83ee653f","review":{"adjudication_id":null,"independent_decision":null,"independent_reviewer_id":null,"primary_decision":"confirmed","primary_reviewer_id":"reviewer-codex-primary-001"},"sample_id":"b2-frame-182","schema_version":"1.0.0","sequence":1407,"session_id":"user-training-ground-i-20260829","source_id":"user-video-training-ground-i","source_locator":{"kind":"frame_index","timing_truth":false,"value":1407},"source_provenance_id":"703e65e56f2b009aab04d52bfd7e5cab4f8abb42e28919970aeaca767c909689","truth_id":"b2-truth-182","truth_scope":"frame_ingestion_only","wrong_size_negative":false}
