{"cas_ref":"cas://sha256/ef113fc266cc43e5b82217f03162ae8a5e36db60b0e054786dd9ffbc47ecd942","category":"wrong_size","derivation":{"calibration_sha256":"bde680518546eaef708f190a7087b5d7b6623a1b744826d5e9565d63d2c5d549","deidentified_derivative_sha256":null,"extraction_artifact_sha256":"136bc8bc68749d834400788944f62a0d46c678de997d4a150fd7a6c0a4ae5308","extraction_tool_sha256":"31bf7993fcce9b02c47a3ce14c8217f2c3cc79063a895cf155bc9718079cd4a2","extraction_tool_version":"import-frame-corpus-v1","parent_pixel_digest":null,"redaction_artifact_sha256":null,"redaction_mode":"not_applicable_hash_only","source_artifact_sha256":"663c90623903436c657b4a633e9d29e19ff529734d641886993e57d826aa1229","transform_version":"capture-v1"},"expected_admission":"fatal","expected_reason_code":"frame_size_changed","expected_status":"frame_size_changed","pixel_artifact_sha256":"1d08ef8a158d48401b0977c2d143cfaed8dd29c5d46c6ad9051917357ff44646","pixel_digest":"ef113fc266cc43e5b82217f03162ae8a5e36db60b0e054786dd9ffbc47ecd942","pixel_spec":{"channels":3,"dtype":"uint8","height":720,"length":2764800,"pixel_format":"BGR8","stride":3840,"width":1280},"privacy":{"class":"restricted","license_id":"user-provided-project-evaluation","retention":"candidate"},"record_digest":"f3be81de3447e93c438f0187b92f185c339b5aedc950b7b058b32bb9d44c8685","review":{"adjudication_id":null,"independent_decision":"confirmed","independent_reviewer_id":"reviewer-automated-secondary-002","primary_decision":"confirmed","primary_reviewer_id":"reviewer-codex-primary-001"},"sample_id":"b2-frame-240","schema_version":"1.0.0","sequence":788,"session_id":"user-wrong-size-1280x720-20260829","source_id":"user-video-wrong-size-1280x720","source_locator":{"kind":"frame_index","timing_truth":false,"value":788},"source_provenance_id":"22623667d9dc0ae4dce96286f3825d470eca8dac6d586dc49734efd732e736c2","truth_id":"b2-truth-240","truth_scope":"frame_ingestion_only","wrong_size_negative":true}
