{"cas_ref":"cas://sha256/00b265442f41b124eaa1fd10b37cdbf540691e3e841a766ba2ed70ee7f8a8933","category":"motion","derivation":{"calibration_sha256":"bde680518546eaef708f190a7087b5d7b6623a1b744826d5e9565d63d2c5d549","deidentified_derivative_sha256":null,"extraction_artifact_sha256":"364b6718e98c54da5f75c1e0ef9eab4d2a38de3b919181bf668ae34a8cc6f171","extraction_tool_sha256":"31bf7993fcce9b02c47a3ce14c8217f2c3cc79063a895cf155bc9718079cd4a2","extraction_tool_version":"import-frame-corpus-v1","parent_pixel_digest":null,"redaction_artifact_sha256":null,"redaction_mode":"not_applicable_hash_only","source_artifact_sha256":"62b3b2f362a60087dffadb1d5529c4d7a27440adf61a28d30b685c7cda3b273f","transform_version":"capture-v1"},"expected_admission":"accepted","expected_reason_code":"accepted","expected_status":"accepted","pixel_artifact_sha256":"7c998b6d04fb97bd95aff768c793a2dc3191ee31b02ee03e06a747965583d165","pixel_digest":"00b265442f41b124eaa1fd10b37cdbf540691e3e841a766ba2ed70ee7f8a8933","pixel_spec":{"channels":3,"dtype":"uint8","height":1080,"length":6220800,"pixel_format":"BGR8","stride":5760,"width":1920},"privacy":{"class":"restricted","license_id":"operator-controlled-live-capture","retention":"candidate"},"record_digest":"ccfecbfd6dbe758a75618ee28e782268546fb9c7c02a76f17fc36174c8b0e4f3","review":{"adjudication_id":null,"independent_decision":null,"independent_reviewer_id":null,"primary_decision":"confirmed","primary_reviewer_id":"reviewer-codex-primary-001"},"sample_id":"b2-frame-057","schema_version":"1.0.0","sequence":5534,"session_id":"vc003-live-20260829T140846Z","source_id":"capture-card-primary","source_locator":{"kind":"live_sequence","timing_truth":false,"value":5534},"source_provenance_id":"94c2a899429c230ded1d56307bfb418e4049405cbd419c75bdd89353db867f91","truth_id":"b2-truth-057","truth_scope":"frame_ingestion_only","wrong_size_negative":false}
