{"cas_ref":"cas://sha256/c694a8d3fd0007944aaa14a04d638e60b13f2d5e0f5a8e95b55b15dc1fb1ad9e","category":"motion","derivation":{"calibration_sha256":"bde680518546eaef708f190a7087b5d7b6623a1b744826d5e9565d63d2c5d549","deidentified_derivative_sha256":null,"extraction_artifact_sha256":"2d39a5cab72e609340607b0350467b99868ead521340985fa5f370e44a0018ee","extraction_tool_sha256":"31bf7993fcce9b02c47a3ce14c8217f2c3cc79063a895cf155bc9718079cd4a2","extraction_tool_version":"import-frame-corpus-v1","parent_pixel_digest":null,"redaction_artifact_sha256":null,"redaction_mode":"not_applicable_hash_only","source_artifact_sha256":"b3c3a5059651e342360f6cf3cf4ca835c4734cb1a3398d9f00e147c4285c9770","transform_version":"capture-v1"},"expected_admission":"accepted","expected_reason_code":"accepted","expected_status":"accepted","pixel_artifact_sha256":"3c388e5617e09e1134f657bb8f8cec3827148322da92759f9f136afb0f62051b","pixel_digest":"c694a8d3fd0007944aaa14a04d638e60b13f2d5e0f5a8e95b55b15dc1fb1ad9e","pixel_spec":{"channels":3,"dtype":"uint8","height":1080,"length":6220800,"pixel_format":"BGR8","stride":5760,"width":1920},"privacy":{"class":"restricted","license_id":"project-owned-capture","retention":"candidate"},"record_digest":"b87da891203a51c4f7a6df8d81847d84fab45fdc0b1ffc8ee4558dcc0c570862","review":{"adjudication_id":null,"independent_decision":null,"independent_reviewer_id":null,"primary_decision":"confirmed","primary_reviewer_id":"reviewer-codex-primary-001"},"sample_id":"b2-frame-118","schema_version":"1.0.0","sequence":457,"session_id":"legacy-vc003-capture-20260821","source_id":"legacy-vc003-capture-sample-20260821","source_locator":{"kind":"frame_index","timing_truth":false,"value":457},"source_provenance_id":"bc370a7a95b9d0b1b2d483acc27f5f95e065d97b456906a2381d57670ca1938a","truth_id":"b2-truth-118","truth_scope":"frame_ingestion_only","wrong_size_negative":false}
