{"cas_ref":"cas://sha256/77ab7e3bbf38c993cefedc29bc56b6d31352dcd5469abd99e50fb40dd878c3a7","category":"motion","derivation":{"calibration_sha256":"bde680518546eaef708f190a7087b5d7b6623a1b744826d5e9565d63d2c5d549","deidentified_derivative_sha256":null,"extraction_artifact_sha256":"44cfe084c8975e8fe8d5421308e256ebdd391cb2a106e74a61960d1ef7a86013","extraction_tool_sha256":"31bf7993fcce9b02c47a3ce14c8217f2c3cc79063a895cf155bc9718079cd4a2","extraction_tool_version":"import-frame-corpus-v1","parent_pixel_digest":null,"redaction_artifact_sha256":null,"redaction_mode":"not_applicable_hash_only","source_artifact_sha256":"b3c3a5059651e342360f6cf3cf4ca835c4734cb1a3398d9f00e147c4285c9770","transform_version":"capture-v1"},"expected_admission":"accepted","expected_reason_code":"accepted","expected_status":"accepted","pixel_artifact_sha256":"a0653e17dc418d829af18c2cb67b4a583070d368d190d09ac1b33df10f8e8484","pixel_digest":"77ab7e3bbf38c993cefedc29bc56b6d31352dcd5469abd99e50fb40dd878c3a7","pixel_spec":{"channels":3,"dtype":"uint8","height":1080,"length":6220800,"pixel_format":"BGR8","stride":5760,"width":1920},"privacy":{"class":"restricted","license_id":"project-owned-capture","retention":"candidate"},"record_digest":"090513858df682686952bd4cd76be4ab1f611331f2199ae438dded8447f190fd","review":{"adjudication_id":null,"independent_decision":null,"independent_reviewer_id":null,"primary_decision":"confirmed","primary_reviewer_id":"reviewer-codex-primary-001"},"sample_id":"b2-frame-138","schema_version":"1.0.0","sequence":964,"session_id":"legacy-vc003-capture-20260821","source_id":"legacy-vc003-capture-sample-20260821","source_locator":{"kind":"frame_index","timing_truth":false,"value":964},"source_provenance_id":"bc370a7a95b9d0b1b2d483acc27f5f95e065d97b456906a2381d57670ca1938a","truth_id":"b2-truth-138","truth_scope":"frame_ingestion_only","wrong_size_negative":false}
