{"cas_ref":"cas://sha256/20995c8e8750bd473529c8ef683e153bf45477a0f7824981ba3301c30b7e7626","category":"transition","derivation":{"calibration_sha256":"bde680518546eaef708f190a7087b5d7b6623a1b744826d5e9565d63d2c5d549","deidentified_derivative_sha256":null,"extraction_artifact_sha256":"f3db8df18657c09e8960262fe0ae0d7f6d93261f351482a665243d8e8514fa38","extraction_tool_sha256":"31bf7993fcce9b02c47a3ce14c8217f2c3cc79063a895cf155bc9718079cd4a2","extraction_tool_version":"import-frame-corpus-v1","parent_pixel_digest":null,"redaction_artifact_sha256":null,"redaction_mode":"not_applicable_hash_only","source_artifact_sha256":"e72d6e77711c8e3977d83a677eab30f859fdefa1700eb50f0efc73b8f9361075","transform_version":"capture-v1"},"expected_admission":"accepted","expected_reason_code":"accepted","expected_status":"accepted","pixel_artifact_sha256":"def9e5c6200592da4baa95471f3a0e83c682ef2f23516d6f02cbbfbf38e46eef","pixel_digest":"20995c8e8750bd473529c8ef683e153bf45477a0f7824981ba3301c30b7e7626","pixel_spec":{"channels":3,"dtype":"uint8","height":1080,"length":6220800,"pixel_format":"BGR8","stride":5760,"width":1920},"privacy":{"class":"restricted","license_id":"user-provided-project-evaluation","retention":"candidate"},"record_digest":"14db8f015d8557921cdf5a52fbd6d56dea4c3d7df8b48603af1f36bc12769e3a","review":{"adjudication_id":null,"independent_decision":null,"independent_reviewer_id":null,"primary_decision":"confirmed","primary_reviewer_id":"reviewer-codex-primary-001"},"sample_id":"b2-frame-197","schema_version":"1.0.0","sequence":2066,"session_id":"user-training-ground-i-20260829","source_id":"user-video-training-ground-i","source_locator":{"kind":"frame_index","timing_truth":false,"value":2066},"source_provenance_id":"703e65e56f2b009aab04d52bfd7e5cab4f8abb42e28919970aeaca767c909689","truth_id":"b2-truth-197","truth_scope":"frame_ingestion_only","wrong_size_negative":false}
