{"cas_ref":"cas://sha256/cb9b3c4d0be2c9cf02b02078212331c18cf89f6fd3a0735f2fffc83f16f365de","category":"motion","derivation":{"calibration_sha256":"bde680518546eaef708f190a7087b5d7b6623a1b744826d5e9565d63d2c5d549","deidentified_derivative_sha256":null,"extraction_artifact_sha256":"84647545a95ef8ea26ca65f90c8462bfb14558600280c8e4393ba7a0453c0ba3","extraction_tool_sha256":"31bf7993fcce9b02c47a3ce14c8217f2c3cc79063a895cf155bc9718079cd4a2","extraction_tool_version":"import-frame-corpus-v1","parent_pixel_digest":null,"redaction_artifact_sha256":null,"redaction_mode":"not_applicable_hash_only","source_artifact_sha256":"62b3b2f362a60087dffadb1d5529c4d7a27440adf61a28d30b685c7cda3b273f","transform_version":"capture-v1"},"expected_admission":"accepted","expected_reason_code":"accepted","expected_status":"accepted","pixel_artifact_sha256":"ca9de1745bf27cf717352e693cec77a943341bb04af4b06ddfe839e4ec009125","pixel_digest":"cb9b3c4d0be2c9cf02b02078212331c18cf89f6fd3a0735f2fffc83f16f365de","pixel_spec":{"channels":3,"dtype":"uint8","height":1080,"length":6220800,"pixel_format":"BGR8","stride":5760,"width":1920},"privacy":{"class":"restricted","license_id":"operator-controlled-live-capture","retention":"candidate"},"record_digest":"b4a55ba098702a11fe7ad60998518c82e726c4a4770bfdd1bbe295007be01021","review":{"adjudication_id":null,"independent_decision":null,"independent_reviewer_id":null,"primary_decision":"confirmed","primary_reviewer_id":"reviewer-codex-primary-001"},"sample_id":"b2-frame-083","schema_version":"1.0.0","sequence":7614,"session_id":"vc003-live-20260829T140846Z","source_id":"capture-card-primary","source_locator":{"kind":"live_sequence","timing_truth":false,"value":7614},"source_provenance_id":"94c2a899429c230ded1d56307bfb418e4049405cbd419c75bdd89353db867f91","truth_id":"b2-truth-083","truth_scope":"frame_ingestion_only","wrong_size_negative":false}
