{"cas_ref":"cas://sha256/e4ce8541b1a886b0697d85e33f8268837bdba66979dec2efb879be88ac2ceee5","category":"motion","derivation":{"calibration_sha256":"bde680518546eaef708f190a7087b5d7b6623a1b744826d5e9565d63d2c5d549","deidentified_derivative_sha256":null,"extraction_artifact_sha256":"0309e9347fac282cc3160d7a711ae9db05e1f7580407b0155fd6efb1126bc306","extraction_tool_sha256":"31bf7993fcce9b02c47a3ce14c8217f2c3cc79063a895cf155bc9718079cd4a2","extraction_tool_version":"import-frame-corpus-v1","parent_pixel_digest":null,"redaction_artifact_sha256":null,"redaction_mode":"not_applicable_hash_only","source_artifact_sha256":"b3c3a5059651e342360f6cf3cf4ca835c4734cb1a3398d9f00e147c4285c9770","transform_version":"capture-v1"},"expected_admission":"accepted","expected_reason_code":"accepted","expected_status":"accepted","pixel_artifact_sha256":"fe70ac83549c57b4cf0cb6a0e27ea31fb1c73016ed1cec191f8cd0fb72dfa044","pixel_digest":"e4ce8541b1a886b0697d85e33f8268837bdba66979dec2efb879be88ac2ceee5","pixel_spec":{"channels":3,"dtype":"uint8","height":1080,"length":6220800,"pixel_format":"BGR8","stride":5760,"width":1920},"privacy":{"class":"restricted","license_id":"project-owned-capture","retention":"candidate"},"record_digest":"33f6694228738907521a6840184366486217f42d1e0a7bffb3d912888fbe41bf","review":{"adjudication_id":null,"independent_decision":null,"independent_reviewer_id":null,"primary_decision":"confirmed","primary_reviewer_id":"reviewer-codex-primary-001"},"sample_id":"b2-frame-148","schema_version":"1.0.0","sequence":1218,"session_id":"legacy-vc003-capture-20260821","source_id":"legacy-vc003-capture-sample-20260821","source_locator":{"kind":"frame_index","timing_truth":false,"value":1218},"source_provenance_id":"bc370a7a95b9d0b1b2d483acc27f5f95e065d97b456906a2381d57670ca1938a","truth_id":"b2-truth-148","truth_scope":"frame_ingestion_only","wrong_size_negative":false}
