{"cas_ref":"cas://sha256/37aa032dae8c52b31c5bcf564264cf5c977f5c62ae703216b8f15aca739675fe","category":"static","derivation":{"calibration_sha256":"bde680518546eaef708f190a7087b5d7b6623a1b744826d5e9565d63d2c5d549","deidentified_derivative_sha256":null,"extraction_artifact_sha256":"998819fd578b5d88ec141c8319876bbe2218bdfa547dd9f8f02131d38eaa0462","extraction_tool_sha256":"31bf7993fcce9b02c47a3ce14c8217f2c3cc79063a895cf155bc9718079cd4a2","extraction_tool_version":"import-frame-corpus-v1","parent_pixel_digest":null,"redaction_artifact_sha256":null,"redaction_mode":"not_applicable_hash_only","source_artifact_sha256":"e72d6e77711c8e3977d83a677eab30f859fdefa1700eb50f0efc73b8f9361075","transform_version":"capture-v1"},"expected_admission":"accepted","expected_reason_code":"accepted","expected_status":"accepted","pixel_artifact_sha256":"1935ba0046dc1bf28ad6861b4d1fb341ab1ffd515f50c152a2129b409cca718d","pixel_digest":"37aa032dae8c52b31c5bcf564264cf5c977f5c62ae703216b8f15aca739675fe","pixel_spec":{"channels":3,"dtype":"uint8","height":1080,"length":6220800,"pixel_format":"BGR8","stride":5760,"width":1920},"privacy":{"class":"restricted","license_id":"user-provided-project-evaluation","retention":"candidate"},"record_digest":"3e574d649700759ca863d76e388023d8a8ebd5a628eadcca94b1804e06faabce","review":{"adjudication_id":null,"independent_decision":"confirmed","independent_reviewer_id":"reviewer-automated-secondary-002","primary_decision":"confirmed","primary_reviewer_id":"reviewer-codex-primary-001"},"sample_id":"b2-frame-150","schema_version":"1.0.0","sequence":1,"session_id":"user-training-ground-i-20260829","source_id":"user-video-training-ground-i","source_locator":{"kind":"frame_index","timing_truth":false,"value":1},"source_provenance_id":"703e65e56f2b009aab04d52bfd7e5cab4f8abb42e28919970aeaca767c909689","truth_id":"b2-truth-150","truth_scope":"frame_ingestion_only","wrong_size_negative":false}
