{"cas_ref":"cas://sha256/6385833acc3a79bf08f428b459e2ae2bbdb6222f7c055fc6a989250c3e1eaaff","category":"motion","derivation":{"calibration_sha256":"bde680518546eaef708f190a7087b5d7b6623a1b744826d5e9565d63d2c5d549","deidentified_derivative_sha256":null,"extraction_artifact_sha256":"5acf47ed57e468a8afe94b269937f0e8878a7196bdbeb1b743e304ed52867d94","extraction_tool_sha256":"31bf7993fcce9b02c47a3ce14c8217f2c3cc79063a895cf155bc9718079cd4a2","extraction_tool_version":"import-frame-corpus-v1","parent_pixel_digest":null,"redaction_artifact_sha256":null,"redaction_mode":"not_applicable_hash_only","source_artifact_sha256":"b3c3a5059651e342360f6cf3cf4ca835c4734cb1a3398d9f00e147c4285c9770","transform_version":"capture-v1"},"expected_admission":"accepted","expected_reason_code":"accepted","expected_status":"accepted","pixel_artifact_sha256":"b40e7116435193f8a8177f19f209242481ec30281682750de69529ed17ca761d","pixel_digest":"6385833acc3a79bf08f428b459e2ae2bbdb6222f7c055fc6a989250c3e1eaaff","pixel_spec":{"channels":3,"dtype":"uint8","height":1080,"length":6220800,"pixel_format":"BGR8","stride":5760,"width":1920},"privacy":{"class":"restricted","license_id":"project-owned-capture","retention":"candidate"},"record_digest":"90c2e5d078ba662f940b794aa371418bd497db35bee91bfed82874267a65e2d0","review":{"adjudication_id":null,"independent_decision":"confirmed","independent_reviewer_id":"reviewer-automated-secondary-002","primary_decision":"confirmed","primary_reviewer_id":"reviewer-codex-primary-001"},"sample_id":"b2-frame-105","schema_version":"1.0.0","sequence":127,"session_id":"legacy-vc003-capture-20260821","source_id":"legacy-vc003-capture-sample-20260821","source_locator":{"kind":"frame_index","timing_truth":false,"value":127},"source_provenance_id":"bc370a7a95b9d0b1b2d483acc27f5f95e065d97b456906a2381d57670ca1938a","truth_id":"b2-truth-105","truth_scope":"frame_ingestion_only","wrong_size_negative":false}
