{"cas_ref":"cas://sha256/b58f0ffa5c30401a8918edb752efbdc78de17998c73f8faaf68df5cf917141ba","category":"wrong_size","derivation":{"calibration_sha256":"bde680518546eaef708f190a7087b5d7b6623a1b744826d5e9565d63d2c5d549","deidentified_derivative_sha256":null,"extraction_artifact_sha256":"1bdd6e2d2ef94812039bb339c8bbfae5d1c5d692ea002df0fa4ccda1b4d40a87","extraction_tool_sha256":"31bf7993fcce9b02c47a3ce14c8217f2c3cc79063a895cf155bc9718079cd4a2","extraction_tool_version":"import-frame-corpus-v1","parent_pixel_digest":null,"redaction_artifact_sha256":null,"redaction_mode":"not_applicable_hash_only","source_artifact_sha256":"663c90623903436c657b4a633e9d29e19ff529734d641886993e57d826aa1229","transform_version":"capture-v1"},"expected_admission":"fatal","expected_reason_code":"frame_size_changed","expected_status":"frame_size_changed","pixel_artifact_sha256":"dcc047841277ae741fd3af48331d7af5f197de1245c688c4d69effb6c4997658","pixel_digest":"b58f0ffa5c30401a8918edb752efbdc78de17998c73f8faaf68df5cf917141ba","pixel_spec":{"channels":3,"dtype":"uint8","height":720,"length":2764800,"pixel_format":"BGR8","stride":3840,"width":1280},"privacy":{"class":"restricted","license_id":"user-provided-project-evaluation","retention":"candidate"},"record_digest":"2d12cf5aa3041e09b4dab760ee9361edcc44a4d4afbdc68f5aa36706961cbff3","review":{"adjudication_id":null,"independent_decision":null,"independent_reviewer_id":null,"primary_decision":"confirmed","primary_reviewer_id":"reviewer-codex-primary-001"},"sample_id":"b2-frame-238","schema_version":"1.0.0","sequence":749,"session_id":"user-wrong-size-1280x720-20260829","source_id":"user-video-wrong-size-1280x720","source_locator":{"kind":"frame_index","timing_truth":false,"value":749},"source_provenance_id":"22623667d9dc0ae4dce96286f3825d470eca8dac6d586dc49734efd732e736c2","truth_id":"b2-truth-238","truth_scope":"frame_ingestion_only","wrong_size_negative":true}
