{"cas_ref":"cas://sha256/e25a46b00359d8d14552fd359552bbffb4a7c9ea9c1f3ebd120aa58e5c467e26","category":"motion","derivation":{"calibration_sha256":"bde680518546eaef708f190a7087b5d7b6623a1b744826d5e9565d63d2c5d549","deidentified_derivative_sha256":null,"extraction_artifact_sha256":"523b77e012d66caf5016f7e35f4bed13ed0d32a49fa2a0bd6b94b1f6b1605241","extraction_tool_sha256":"31bf7993fcce9b02c47a3ce14c8217f2c3cc79063a895cf155bc9718079cd4a2","extraction_tool_version":"import-frame-corpus-v1","parent_pixel_digest":null,"redaction_artifact_sha256":null,"redaction_mode":"not_applicable_hash_only","source_artifact_sha256":"b3c3a5059651e342360f6cf3cf4ca835c4734cb1a3398d9f00e147c4285c9770","transform_version":"capture-v1"},"expected_admission":"accepted","expected_reason_code":"accepted","expected_status":"accepted","pixel_artifact_sha256":"e04eb0af328c51149399d0ee4bbabec9652f4100db6e7c8f4220766afcaa86b3","pixel_digest":"e25a46b00359d8d14552fd359552bbffb4a7c9ea9c1f3ebd120aa58e5c467e26","pixel_spec":{"channels":3,"dtype":"uint8","height":1080,"length":6220800,"pixel_format":"BGR8","stride":5760,"width":1920},"privacy":{"class":"restricted","license_id":"project-owned-capture","retention":"candidate"},"record_digest":"1326335dca443ef7ec35161c6b4283b77581f3c1e119d43ac7198a0d219f8016","review":{"adjudication_id":null,"independent_decision":"confirmed","independent_reviewer_id":"reviewer-automated-secondary-002","primary_decision":"confirmed","primary_reviewer_id":"reviewer-codex-primary-001"},"sample_id":"b2-frame-125","schema_version":"1.0.0","sequence":635,"session_id":"legacy-vc003-capture-20260821","source_id":"legacy-vc003-capture-sample-20260821","source_locator":{"kind":"frame_index","timing_truth":false,"value":635},"source_provenance_id":"bc370a7a95b9d0b1b2d483acc27f5f95e065d97b456906a2381d57670ca1938a","truth_id":"b2-truth-125","truth_scope":"frame_ingestion_only","wrong_size_negative":false}
