{"cas_ref":"cas://sha256/a43ccaef476090b00815b2461a89b7a9a575b89e87db57d4e5b9be2af15b7982","category":"wrong_size","derivation":{"calibration_sha256":"bde680518546eaef708f190a7087b5d7b6623a1b744826d5e9565d63d2c5d549","deidentified_derivative_sha256":null,"extraction_artifact_sha256":"bd1d4583ebed8d555cb3a46eba9c0ad4170e444f89ae8b5cccaafe684184300b","extraction_tool_sha256":"31bf7993fcce9b02c47a3ce14c8217f2c3cc79063a895cf155bc9718079cd4a2","extraction_tool_version":"import-frame-corpus-v1","parent_pixel_digest":null,"redaction_artifact_sha256":null,"redaction_mode":"not_applicable_hash_only","source_artifact_sha256":"663c90623903436c657b4a633e9d29e19ff529734d641886993e57d826aa1229","transform_version":"capture-v1"},"expected_admission":"fatal","expected_reason_code":"frame_size_changed","expected_status":"frame_size_changed","pixel_artifact_sha256":"5a0dfc0d1c2853bda4e78f1c4dba15abe9d890f935b12a6ce0cb86c87fb6c9af","pixel_digest":"a43ccaef476090b00815b2461a89b7a9a575b89e87db57d4e5b9be2af15b7982","pixel_spec":{"channels":3,"dtype":"uint8","height":720,"length":2764800,"pixel_format":"BGR8","stride":3840,"width":1280},"privacy":{"class":"restricted","license_id":"user-provided-project-evaluation","retention":"candidate"},"record_digest":"f75d5a183043d67f5248f2b4837f9c129e76a7a95e390e5d171b4d4eb0100aa2","review":{"adjudication_id":null,"independent_decision":null,"independent_reviewer_id":null,"primary_decision":"confirmed","primary_reviewer_id":"reviewer-codex-primary-001"},"sample_id":"b2-frame-218","schema_version":"1.0.0","sequence":355,"session_id":"user-wrong-size-1280x720-20260829","source_id":"user-video-wrong-size-1280x720","source_locator":{"kind":"frame_index","timing_truth":false,"value":355},"source_provenance_id":"22623667d9dc0ae4dce96286f3825d470eca8dac6d586dc49734efd732e736c2","truth_id":"b2-truth-218","truth_scope":"frame_ingestion_only","wrong_size_negative":true}
